<?xml version="1.1" encoding="UTF-8" standalone="no"?>

<Bibliotheque
    xmlns:xsi="http://www.w3.org/2001/XMLSchema-instance"
    xsi:noNamespaceSchemaLocation="Bibliotheque.xsd">
    <Livre>
        <Titre>Circe</Titre>
        <Auteur>
            <Nom>Miller</Nom>
            <Prenom>M</Prenom>
        </Auteur>
        <Tomes>
            <Tome sous-titre="Sur la Lune" nbPages="365"></Tome>
        </Tomes>
        <InfosEdition>
            <Editeur>Gallimar</Editeur>
            <LieuEdition>Paris</LieuEdition>
            <LieuImpression>Bruxelles</LieuImpression>
            <ISBN>1234567891</ISBN>
        </InfosEdition>
    </Livre>
    <Article>
        <Titre sous-titre="La violence symbolique de l'école">La sociologie de l'éducation</Titre>
        <Auteur>
            <Nom>Bourdieu</Nom>
            <Prenom>P</Prenom>
        </Auteur>
        <InfosPublication nomJournal="Feuille de Chou">
            <Pages>45</Pages>
            <AnneePublication>2021</AnneePublication>
            <NumeroJournal>21</NumeroJournal>
        </InfosPublication>
    </Article>
</Bibliotheque>